Laptops;Desktop;Monitors;Computer Mice;Keyboard;Mouse and Keyboard Combo;Computer Headphones;Active Headphones;Computer Cords;Accessories;Speakers;Printers;Printer Ink;Computer Stands;Computer Tablets;External Hardrives;Smart Home Devices;
LG Touchscreen Laptop;Lenovo Desktop Computer;Acer Monitor;3-Button Mouse;HP USB Keyboard;Logitech MK550 Wireless Wave Keyboard and Mouse Combo;Zombie Gaming Headset;Apple Earpods;HDMI Cable 6ft;Microsoft Office Home and Student 2016;Cambridge Bluetooth Speaker;Epson Printer;Epson Black Ink;Halter Acrylic Monitor Stand;iPad;1TB Portable External Hard Drive;Apple TV;
Acer Aspire;iMac;LG Monitor;Logitech Wireless Mouse;Logitech Wireless Keyboard;Logitech Desktop MK120 Mouse and keyboard Combo;Logitech ClearChat Headset;Monster Beats By Dr Dre;Ethernet Cable;Computer Game;JBL Splashproof Portable Bluetooth Speaker;HP Wireless Printer;HP Black & Tri-color Ink;Height-Adjustable Standing Desk;iPad Pro;2TB Portable External Hard Drive;Google Home;
HP Laptop;HP Desktop;ASUS Monitor;Microsoft Basic Optical Mouse;Rii LED Keyboard;Logitech MK270 Wireless Keyboard and Mouse Combo;Panasonic On-Ear Stereo Headphones RP-HT21;Otium Wireless Sports Bluetooth Headphones;Etekcity Power Extension Cord Cable;Belkin Mouse Pad;DOSS Touch Wireless Bluetooth;Canon Office Printer;Canon Ink;Multi Media Stand;Fire HD Tablet;5TB Desktop Hard Drive;Smart Light Bulb;
ASUS Chromebook;ASUS Desktop;ASUS 2 Monitor;Logitech 3-button Mouse;Logitech Keyboard;Dell KM117 Wireless Keyboard & Mouse;PC Gaming Headset;Panasonic In-Ear Headphone;Audio Cable;Large Mouse Pad;Logitech Multimedia Speakers;Brother Printer;Brother Printer Toner;Halter Mesh Metal Monitor Stand;Samsung Galaxy Tab;Slim 2TB Portable External Hard Drive;Fire TV Stick;
Apple Macbook Pro;Dell Desktop;Dell Monitor;Redragon Gaming Mouse;Backlit LED Gaming Keyboard;EagleTec Wireless Combo Keyboard and Mouse;Kensington Headphones;APIE Bluetooth Headphones;VGA Monitor Cable;;Rokono Mini Speaker;DYMO Label Manker;DYMO Labeling Tape;Full Motion Monitor Mount;Kindle;3TB Portable External Hard Drive;Roku Express;
Apple MacBook Air;Intel Desktop;Samsung Monitor;HP Wireless Mouse;Dell Wired Keyboard;Microsoft Wireless Comfort Keyboard and Mouse;Logitech Stereo Headset;Philips Flexible Earhook Headphones;iPhone Charger Cable;;Cyber Acoustics;;;;;;;
Dell Laptop;Acer Desktop;Sceptre Monitor;Generic Black 3-Button;Apple Wired Keyboard;Microsoft Wireless Desktop Keyboard and Mouse;Koss Home Headphones;;HDMI Adapter;;Bose Companion Speakers;;;;;;;
Eluktronics Pro Gaming Laptop;CYBERPOWER Gamer Desktop;ViewSonic Monitor;Wireless Portable Mouse;Apple Wireless Keyboard;Rii LED Gaming Keyboard & Mouse Combo;Microsoft Headset;;USB Cable;;Mackie CR Speakers;;;;;;;
"Alienware AW17R4-7345SLV-PUS 17"" Laptop";Dell 2 Desktop;AOC Monitor;Gaming Mouse Professional;Apple Magic Keyboard;Logitech MK360 Wireless Keyboard and Mouse Combo;Ailihen Stereo Headphones;;Samsung Charging Cable;;Sonos;;;;;;;
HP Notebook Touchscreen Laptop PC;;HP Monitor;Slim Wireless Mouse;;;XIBERIA Gaming Headset;;;;;;;;;;;
